Job Title,Company,Minimum Qualification,Skills Required,Location,Years of Experience,Date Posted,Department,Summary
Vacancies at d.light,d.light,,Skills And Key Competencies,,3-5 years’ experience in a busy FMCG environment.,,Other, The incumbent will ensure that stock control procedures are in place and adhered to in order to safe guard Company stocks . The Stock Controller is the custodian of stock record & balances .
"Journalist, BBC Somali at BBC World Service",BBC World Service,,YOUR SKILLS AND EXPERIENCE,,YOUR SKILLS AND EXPERIENCE,,Other," There is a golden opportunity to become a Journalist in BBC Somali as we seek to extend its trusted reputation across radio and digital for the next generation . By joining the team, you will receive first-class training and share your stories with millions of BBC’s global audience ."
Early Years Foundation Stage (EYFS) Teacher / Kindergarten Teacher at Kabete Junior Academy,Kabete Junior Academy,,,,A minimum of 5 years of teaching experience in a Kindergarten setting.,,Education," Kabete Junior Academy is a leading British Curriculum Kindergarten . School blends nature, creativity, and global best practices to create a nurturing environment for learners aged 16 months to 6 years ."
GEF Project Specialist II at United Nations Environment Programme (UNEP),United Nations Environment Programme (UNEP),Qualifications/special skills,Qualifications/special skills,,A first level degree with additional two years of qualifying experience maybe accepted in lieu of an advanced university degree.,,Other," Project Specialist is required to manage part of UNEP's portfolio of GEF mitigation projects in Latin American and the Caribbean . Thematic areas of these projects include those related to sustainable cities, low-carbon mobility, energy efficiency and climate transparency ."
Commission-Based Insurance Agents at VisionFund Kenya,VisionFund Kenya,,Strong interpersonal and relationship-building skills,,"Previous experience in sales, customer service, or insurance is a strong advantage",,Other," VFK is looking for dynamic, purpose driven, and results-oriented Commission-Based Insurance Agents to join our expanding team . You will play a vital role in offering trusted insurance solutions to clients ."
Vacancies at Kenya Builders & Concrete Co. Ltd,Kenya Builders & Concrete Co. Ltd,,,,,,Other," As an Accounts Manager, your primary responsibility is to foster and maintain strong relationships with clients . You will be the main point of contact between the company and its clients, working to understand their needs and address concerns ."
Latest Recruitments at CDL Human Resource,CDL Human Resource,Qualifications- Academic and Professional,,,"Audit adherence to policies and procedures and take the necessary actions i.e. Team Training, execute stock takes, customer experience surveys",,Human Resources," Key Responsibilities: Drive the Revenue & Profitability of the Shops within allocated Retail cluster . Manage the shops look and feel consistent with the brand, uniforms and consistency in animation activities inside or outside the shop. Manage balance between consignment stocks and DFP sales with an objective of maximising device sales ."
Latest Recruitment at APA Life Assurance Company Ltd,APA Life Assurance Company Ltd,ACADEMIC QUALIFICATIONS,JOB SKILLS AND REQUIREMENTS,,EXPERIENCE,,Other," The role includes sourcing, procuring and procuring of business in line with the set targets/budgets . The role is a member of the Executive Executive Committee . The experience experience includes a Bachelor's degree in relevant field ."
Tupande Soko Chief of Staff at One Acre Fund,One Acre Fund,Qualifications,,,5+ years of working experience with 3+ years of strategy or management consulting experience,,Other, You will collaborate with senior leadership to develop and implement operational strategies and deliver special projects that align with the overall business objectives . You will identify and streamline bottlenecks in internal operations and manage tracking of important departmental controls .
Careers at Britam,Britam,"Knowledge, experience and qualifications required",,,"Knowledge, experience and qualifications required",,Other," Job Purpose: Reviewing proposal forms, verifying client’s data, counter-checking the terms of the policy as well as reviewing the conditions of policy . Maintain high standards of customer service - responding to clients enquiries; (walk in clients,telephone and emails)"
"Developer, Business Intelligence at Standard Bank Group",Standard Bank Group,Qualifications,"Strong reporting and analytical skills using tools such as SQL, Python & Power BI DAX",,Experience Required,,IT," The Business Intelligence Developer is responsible for designing, developing, and maintaining advanced business intelligence (BI) and performance management solutions . The role enables strategic decision-making by converting business and technical requirements into clear, actionable insights ."
Plant Engineer at LOreal,LOreal,,Strong communication skills to collaborate with diverse teams and stakeholders.,,"A minimum of 5 years of hands-on experience in a manufacturing or production environment, with a specific focus on plant engineering, is preferred.",,IT," As a Plant Engineer at our Nairobi Plant, you’ll be at the heart of our manufacturing operations . Your role will directly contribute to creating beauty that moves the world while upholding the highest standards of environmental responsibility ."
"Officer, IT at BRAC",BRAC,,,,,,Administration," The IT Officer is the first point of contact for all staff at BKCL for information technology support . He will be responsible for providing an effective, professional and customer-focused ICT support service ."
Assistant Accountant at University of Nairobi,University of Nairobi,Applicants must have a Bachelor’s degree in Commerce or an equivalent qualification.,"Applicants should demonstrate a high level of integrity and the ability to maintain confidentiality. They should possess excellent communication, report writing, and analytical skills, and be effective team players.",,Applicants must have at least three (3) years of experience working in a similar position or related field on donor-funded projects.,,IT, Job Description: Assist the Project Accountant and Management team in preparation of annual and activity project budgets . Work closely with the project accountant and administrator to ensure relevant documents are attached to all payment request letters .
Active Jobs at Tatu City Limited,Tatu City Limited,,Skills and Experience,,Skills and Experience,,Other, The Accounts Receivable Accountant will be responsible for overseeing the accounts receivable function . The role includes managing direct reports and reporting directly to the Financial Controller .
Job Openings at The Pharo Foundation,The Pharo Foundation,,Exceptional ability to lead diverse teams across multiple countries and cultures.,,Proven experience in developing and executing growth strategies in the education sector.,,Other," Pharo Schools will expand its school portfolio from 7 to over 15 schools . The network will increase student enrollment from 4,000 to 25,000 over the next 10 years ."
"PP1 Resident Teacher, Maternity Cover (Tatu Primary) at Nova Pioneer",Nova Pioneer,,,,3-5  years of teaching experience,,Education," The role of a teacher in the role is to supervise and supervise children in a safe and secure environment for children . The role includes planning, reviewing and updating the school curriculum in line with the Learning Design team ."
Driver - Lodwar at Inkomoko,Inkomoko,,,,Experience working with humanitarian agencies is desired.,,Other, The position holder will support our team in the day today operations and movement of staff . The position is located in Lodwar- Kenya . The role will include driving authorized Inkomoko staff to and from various destinations .
Vacancies at Thika Power,Thika Power,,,,3+ years’ experience in operation and/or maintenance of a power plant,,Other," Performs skilled work on instrumentation and control systems in all areas of the plant . Inspects, troubleshoots, maintains, repairs, installs, adjusts, and calibrates . The role also performs electrical installation and maintenance works ."
Internship Opportunity - Logistics and Procurement at Concern Worldwide,Concern Worldwide,,,,,,Other," We are seeking applicants for 2 internship positions in;Logistics and Procurement to be based in Nairobi and Tana River . The intern will support and learn from the logistics and procurement staff, gaining exposure to the supply chain process ."
Key Account Manager at Bolt,Bolt,,Excellent communication & written skills in English.,,,,Other, Own the partner’s P&L and be responsible for its profitability and growth . Manage and expand relationships with existing key accounts . Proactively identify new business opportunities while ensuring key accounts meet KPIs .
Sales and Marketing Representative at Baron Capital Limited,Baron Capital Limited,Qualifications,Strong skills in Sales and Sales & Marketing,,Relevant experience in the financial sector is a plus,,Marketing," The Sales and Marketing Representative will be responsible for developing sales strategies, identifying and pursuing new sales opportunities, maintaining customer relationships, and providing excellent customer service . The role involves marketing our financial products and conducting market research ."
Business Development Senior Associate at Voluntas,Voluntas,,"Strong project management, problem-solving, and interpersonal skills",,Proven experience in leading business development initiatives as part of larger bi- and multilateral donor programs or procurement tenders,,Other, Your Responsibilities are to identify potential opportunities to develop and support the development of new projects . Your role is to work with colleagues to develop new projects and present ideas to the public .
Medical Engineering Tutor at Jodan College of Technology,Jodan College of Technology,,,,Over two years training experience.,,IT, Minimum Requirements: Degree or Higher Diploma in Medical Engineering . Over two years training experience . Ability to effectively teach the CBET curriculum .
Finance and Administration Manager at Youth Alive! Kenya (YAK),Youth Alive! Kenya (YAK),Qualifications and Experience,,Strategic Planning and Resource Allocation,Qualifications and Experience,,Finance," The Finance and Administration Manager is responsible for overseeing the financial health and operational efficiency of Youth Alive! Kenya . The FAM will lead a team to uphold transparency, accountability, and compliance with internal policies and donor requirements ."
Deputy Community Relations Coordinator at Victory Farms,Victory Farms,,,,"Proven Experience (3+ years) in community relations public relations, stakeholder management, field work or CSR implementation or a similar role.",,IT," Victory Farms is seeking a Deputy Community Relations Coordinator to build strong, collaborative, and sustainable relationships with surrounding communities . The position requires a proactive and organized individual who can balance fieldwork, administrative tasks, and strategic communication ."
Strategic Procurement Engineering Manager at PowerGen Renewable Energy,PowerGen Renewable Energy,Qualifications,Strong cost management and analytical skills with a strategic mindset.,,"Strong experience in EPC and supplier contract negotiation, execution, and compliance.",,IT," To lead the strategic procurement for PowerGen’s renewable energy projects, manage EPC contract negotiations, coordinating technical assessments and liaising with the engineering team, supplier performance, and cost optimization ."
Pharmacist at Africa Management Solutions Limited (AMSOL),Africa Management Solutions Limited (AMSOL),Required Qualifications,,,,,Healthcare," Role Summary: Responsible for monitoring the supply of all medicines used in the hospital . In charge of purchasing, manufacturing, dispensing, and quality testing their medication stock ."
Project Procurement Specialist at African Union - InterAfrican Bureau for Animal Resources,African Union - InterAfrican Bureau for Animal Resources,Qualifications and Experience Requirements for the Consultant,Demonstrated ability to work in a multicultural environment and good interpersonal skills;,,Qualifications and Experience Requirements for the Consultant,,Other," The objective of the assignment is to provide Procurement Services both technical and operational, in relation to the project . The PS will work with all relevant personnel to ensure the successful delivery of project outputs and project development objectives ."
Project Procurement Specialist at African Union - InterAfrican Bureau for Animal Resources,African Union - InterAfrican Bureau for Animal Resources,Qualifications and Experience Requirements for the Consultant,Demonstrated ability to work in a multicultural environment and good interpersonal skills;,,Qualifications and Experience Requirements for the Consultant,,Other," The objective of the assignment is to provide Procurement Services both technical and operational, in relation to the project . The PS will work with all relevant personnel to ensure the successful delivery of project outputs and project development objectives ."
Collection Officer (Logbook Product) at Phoenix Capital,Phoenix Capital,,Must have Strong communication and presentation skills,,Must have at least 2 years past experience in collection/ the above role.,,Administration," Roles and responsibilities: Processing of loans for new and existing clients . Due diligence including background checks, checking authenticity of collaterals, search, IDs, Work place, premise/business visits, Logbooks, Titles, Receipts and Logbooks ."
Clinical Officer Anaesthetist at Jacaranda Maternity,Jacaranda Maternity,,Knowledge & Skills Requirements,,Experience,,Healthcare, Clinical Officer is to coordinate and discuss planned care with the patient and other team professionals as appropriate . Duties and Responsibilities include monitoring and providing appropriate clinical care ( medical and surgical-anesthesia)
Flloca Advocacy and Communication Consultant at Volunteer Service Overseas (VSO),Volunteer Service Overseas (VSO),,,,VSO is therefore seeking support from an experienced consultant to help the policy and advocacy advisor propose new fundable advocacy models for FLLoCA work.,,Other," VSO has less resources to support community actions, deliver volunteer support or accompany people’s collectives as they implement and measure change in their communities . Investing in FLLoCA is not just a climate imperative—it is a development necessity ."
Communications Officer at Center for Domestic Training and Development,Center for Domestic Training and Development,,,,At least 1year of experience in communications role in non-profit or development sectors.,,IT," As a Communications Officer, you will support the development and execution of digital and offline communication strategies that increase visibility, enhance stakeholder engagement, and promote CDTD's programs and impact . You will work closely with the teams to ensure timely, creative, and strategic dissemination of content across multiple platforms ."
Oncology Nurse at Premier Hospital,Premier Hospital,MINIMUM REQUIREMENTS/ QUALIFICATIONS,,,At least one (1) year of working experience as an Oncology Nurse in reputable health facility.,,Healthcare," The role of this position is to monitor the physical, emotional, and psychological needs of cancer patients . The role includes managing chemotherapy, immunotherapy, and other oncology treatments ."
Quality Assurance at Tenakata,Tenakata,Qualifications,Strong analytical skills to assess data and identify discrepancies..,,"2 years experience in auditing, compliance, quality control, preferably in the financial services industry..",,Other," Quality Assurance Officer will be responsible for Ensuring that all necessary paperwork and records are complete, accurate, and compliant with relevant standards . Will work closely with different departments such as finance, operations and credit to ensure all activities meet required standards ."
Vacancies at Equity Bank Kenya,Equity Bank Kenya,Qualifications,"Strong analytical skills, with experience in leveraging data analytics to drive lending product insights and performance management.",,"Offering technical support to address any issues or questions customers may have during the onboarding process, ensuring a smooth experience.",,Other," The primary purpose is to collect, analyse, and interpret digital data and provide actionable insights . This role supports the organization in improving its digital presence, customer engagement, marketing strategies, and overall performance ."
Inventory Manager at M-KOPA Solar,M-KOPA Solar,,"We are looking for someone with a Bachelor's degree in supply chain management, Business Administration, or related field (or equivalent experience). You should have effective leadership and team management abilities with experience in inventory management and overall supply chain processes. Excellent MS Excel skills are essential, along with strong data analysis capabilities and experience tracking KPIs. Excellent communication and stakeholder management skills are crucial, as is demonstrated ability to work cross-functionally.",,"We are looking for someone with a Bachelor's degree in supply chain management, Business Administration, or related field (or equivalent experience). You should have effective leadership and team management abilities with experience in inventory management and overall supply chain processes. Excellent MS Excel skills are essential, along with strong data analysis capabilities and experience tracking KPIs. Excellent communication and stakeholder management skills are crucial, as is demonstrated ability to work cross-functionally.",,Other," Mobility Inventory Manager will be responsible for overseeing daily inventory operations . You will be the strategic leader who collaborates closely with Retail, Sales, Product Managers to support overall inventory goals and improve operational efficiency ."
Technical Adviser (Climate Resilient Agri-Business Model) at Food and Agriculture Organization,Food and Agriculture Organization,,Technical/Functional Skills,"Work experience in more than one location or area of work, particularly in field positions.","Seven years of relevant experience in technical cooperation related activities, policy advice and analysis relating to food and nutrition security, agriculture and rural development, monitoring and evaluation of policies and programmes.",,Other," Coordinates technical cooperation activities and programme-related activities . Supervises preparation of various written outputs, e.g. background papers, analyses, substantial sections of reports and studies . Contributes to consultative and other meetings, conferences ."
Reproductive Health Officer at International Rescue Committee,International Rescue Committee,,"Work with clinical services team to determine training needs for SRHR service providers and community maternal and newborn health requirements for the targeted population through meetings, skills assessment sessions and /or administering surveys.",,"Foster inter-program linkages (clinical services, community health program and SRHR-HIV), exchange of information and experiences and contribute to an integrated Sexual Reproductive Health & Rights Program with support from Program Managers.",,Healthcare, Work with clinical services team to determine training needs for SRHR service providers and community maternal and newborn health requirements . Ensure high risk clinics are institutionalized and follow-up of mothers at risk is in line with ‘healthy mothers design sprint’
Communications Manager at CLASP,CLASP,Qualifications,"The successful candidate will have expertise delivering impactful communications campaigns and innovative content for global audiences and understand how communications further CLASP’s mission and theory of change. We are seeking an agile, creative communications professional with well-honed listening and interpersonal skills, who is skilled at distilling complex information into clear messages and can adapt to evolving contexts and priorities.",,"web, print publications, briefing papers, digital media, and social media all a plus; experience writing funding proposals ideal.",,Other," The Communications Manager will be responsible for designing, implementing and measuring communications for these portfolios in India . The successful candidate will have expertise delivering impactful communications campaigns and innovative content for global audiences ."
Job Openings at Practical Action Kenya,Practical Action Kenya,,Strong technical skills including use of PowerBI or Tableau.,,"Practical Action believes that it is unacceptable for anyone to experience exploitation or abuse in any form, anywhere. All staff members undergo mandatory Safeguarding training and are expected to always commit/adhere to our Safeguarding Policy whilst working for or on behalf of Practical Action.",,Other, Contribute to the development process of the strategic business plan (SBP) Provide data that supports routine quarterly and annual reporting of the SBP including reporting on the global indicators and show progress against targets .
Sales Development Professional at CMA CGM,CMA CGM,,,,,,Marketing, Main tasks and Responsibility: Support the Reefer Sales Manager with day-to-day customer related matters . Support the reefer manager to formulate commercial strategies which will see CMA CGM reefer Market Share grows within the cluster .
Social Worker/Counselor (Mental Health & Ncd Support) at Matibabu Foundation College of Health Sciences,Matibabu Foundation college of Health Sciences,-,"Excellent interpersonal, communication, and problem-solving skills",,"Training or experience in mental health, trauma, or NCD care required",,Healthcare," The Social Worker/Counselor will provide comprehensive psychosocial support, mental health counseling, and social care linkages for patients, students, and community members . This role is key to Matibabu Foundation’s holistic health model integrating clinical care, emotional resilience and social reintegration ."
Corporate Finance Director - (Fundraising) at Degas,Degas,,Strong leadership skills with the ability to build and develop a high-performing Finance team.,Develop comprehensive business and financial strategies in accordance with Degas’ long-term goals and guide decision-making on prioritization and resource allocation.,5+ years of experience in senior finance and investment roles.,,IT," The Corporate Finance Director / Manager is a critical leadership role driving Degas' financial strategy . This role involves spearheading equity and debt fundraising initiatives, both domestically and internationally, including pitching, financial modeling, due diligence, term negotiations, and closing ."
Accounts Executive at Morsan HR Consulting,Morsan HR Consulting,,"Are you a detail-oriented and client-focused professional with strong interpersonal and analytical skills? We are looking for an enthusiastic Accounts Executive to join our team. Reporting to the Senior Account Manager, this role will be pivotal in managing client relationships, understanding their needs, and ensuring successful service delivery. The ideal candidate should be able to work collaboratively across departments and be proactive in identifying opportunities to add value to client engagements.",,"2+ years’ experience in account management, client relations, or similar roles.",,Human Resources," The ideal candidate should be able to work collaboratively across departments and be proactive in identifying opportunities to add value to client engagements . The role will be pivotal in managing client relationships, understanding their needs and ensuring successful service delivery ."
Careers at Capacity Spring Africa,Capacity Spring Africa,,Good patient handling and communication skills,,Minimum of 1-2 years of relevant working experience (experience in a hospital/rehab center is an added advantage),,Other, Bachelor's degree or Diploma in Physiotherapy from a recognized institution Must be registered and licensed with the Physi Therapy Council of Kenya (PCK) Minimum of 1-2 years of relevant working experience .
Regional Manager: Program Delivery & Training Bilingual (EN/FR) at Teaching at the Right Level Africa,Teaching at the Right Level Africa,,Conduct skills assessment of regional PD&T team to identify learning gaps and provide a structured professional development plan.,,Develop deep knowledge and experience of the TaRL approach. (25%),,IT, Regional Manager PD&T Bilingual (EN/FR) at TaRL Africa plays an integral role in supporting the management and delivery of the Teaching at the Right Level (TaRL) approach .
LPG Regional Sales Manager at Sun King (Formerly Greenlight Planet),Sun King (Formerly Greenlight Planet),,Demonstrate good communication and people relations skills to be able to build and guide large EO teams.,,Are experienced with selling clean cooking products,,Marketing, The LPG Sales Manager will steer sales activities and collections in the area they are assigned for the direct distribution LPG sold on Pay-As-You-Basis . The role is responsible for generating sales and ensuring customers are making repayments .
