Job Title,Company,Minimum Qualification,Skills Required,Location,Years of Experience,Date Posted,Department,Summary
Quantity Surveyor at Magnate Ventures,Magnate Ventures,Qualifications;,,,"Minimum of 5 years of post-graduate experience as a Quantity Surveyor in the construction industry, with a proven track record in cost estimation, budgeting, and contract management.",,Other, The Quantity Surveyor is responsible for performing key aspects of the projects in the production function within the organization . The role requires a proactive and strategic approach to overall project management .
Sales Manager at Magnate Ventures,Magnate Ventures,Job Qualifications,"Excellent leadership, negotiation, and customer relationship skills.",,"Minimum of 5 years’ experience in land sales, with at least 2 years in a supervisory or managerial role.",,Marketing, Job Description: Develop and execute effective land sales strategies to meet company targets . Identify and pursue new market opportunities for land acquisition and resale . Develop and implement promotional strategies for available land parcels .
"Environment, Health and Safety Officer at Magnate Ventures",Magnate Ventures,Job Specification and Qualification,,,"Minimum of 6 years experience in an Environmental, Health and Safety position in Production;",,Healthcare," The Environmental Health and Safety Officer will ensure compliance with government safety regulations and industry standards . The goal for the role is to protect the employees, customers and the environment from any life hazard ."
Homeroom Teacher at Trinitas International School,Trinitas International School,,,,Experience in teaching the Cambridge International Curriculum (KS2–KS3),,Education, Position: Homeroom Teachers with a Bachelor Degree in Education with a specialization in either Math/Geography and Biology/Chemistry . Start date: September 2025; Trinitas International School is rooted in Christian values .
"Program Officer – Research, Monitoring, Evaluation, and Proposal Writing at Selistar Management Services",Selistar Management Services,Qualifications,"The ideal candidate combines strong research and analytical skills, experience in program evaluation and grant writing, and a commitment to results-driven programming.",,"The ideal candidate combines strong research and analytical skills, experience in program evaluation and grant writing, and a commitment to results-driven programming.",,Administration," The Program Officer – Research, Monitoring, Evaluation, and Proposal Writing will lead the development and implementation of research initiatives . This role supports evidence-based program management and contributes to strategic learning, continuous improvement, and organizational growth across various thematic areas ."
Monitoring and Evaluation (M&E) Specialist at Selistar Management Services,Selistar Management Services,Qualifications,,,"Minimum of 7 years of experience in monitoring and evaluation, with at least 4 years in development projects focused on agriculture, agribusiness, or entrepreneurship.",,Other," The Monitoring and Evaluation (M&E) Specialist is responsible for designing, implementing, and managing M&E . The role ensures robust data collection, analysis, and reporting to track the performance across the project counties ."
Request for Proposals for Digital Training Tool at Landolakes Ventures 37,Landolakes Ventures 37,"Statement of Qualifications including evidence in support of its technical qualifications and ability to perform the services if its offer is accepted, such as references to successful prior projects of a similar nature.","Relevance of the firm or organization’s core capability/skills, experience and capacity to implement and manage the assignment (30%)","Following the training, producers should have increased knowledge of the topics covered such that they apply improved cattle nutrition knowledge and use climate-adapted forage varieties. The NPA Kenya team will link the digital platform provider to partner organizations to aid in user identification and will develop materials to help users overcome enrollment and utilization issues; however, it is ultimately the responsibility of the digital training platform provider to reach the targeted number of farmers. The NPA Kenya team will expect to receive monthly reports containing information on number of farmers trained, including geographic locations (county, sub county, and village), date trained, phone number, gender, age, number of cattle owned, number of acres farmed, and if the farmer is producing forage.","Venture37’s long-standing affiliation with Land O’Lakes, Inc. (www.landolakes.com) sets us apart. Land O’Lakes Inc. is one of America’s largest farmer-owned cooperatives. It supports Venture37 project implementation with 100 years of experience in dairy, animal nutrition, crop inputs, and agricultural insights and technologies. This gives our development projects a unique global view of agriculture, food, and the power of well-functioning market systems. Land O’Lakes, Inc. supports these efforts as part of its enterprise purpose of Feeding Human Progress at home and around the world.",,IT, Land O’Lakes Venture37 is soliciting proposals from qualified providers of digital training services for dairy and forage farmers . The Bidder shall bear all costs associated with the preparation and submission of the Proposal .
National Project Manager (NPM) - Agribusiness at Selistar Management Services,Selistar Management Services,Qualifications,"Supervise the rollout of mentorship programs covering agripreneurship, digital literacy, and business skills.",,,,Other," The National Project Manager (NPM) is responsible for the strategic planning, coordination, and management of an Agribusiness Project implementation ."
Human Resources and Administration Manager at HCS Affiliates Group,HCS Affiliates Group,Qualifications and Experience,"Excellent interpersonal, communication, and conflict-resolution skills.",,Qualifications and Experience,,Administration, The Human Resources and Administrative Manager will lead and coordinate all HR and administrative functions to ensure operational excellence and alignment with our clients  values and growth objectives . The role is responsible for developing and implementing HR strategies and initiatives .
Content Agent at HCS Affiliates Group,HCS Affiliates Group,,Should have good MS Excel skills,,At least 1 years of related experience,,Other," Our client, an on-demand Courier Service that delivers products ordered through their mobile app seeks to recruit a Content Agent . He/she will be responsible for assisting current and new clients in activations and upgrades ."
Implementation Officer at Career Options Africa Group,Career Options Africa Ltd,QUALIFICATIONS,The ideal candidate should possess the following skills and competencies.,"data collection, contract setup, monitoring, input allocation, and reporting",Benchmark the client’s implementation experience against alternative tools or legacy systems,,Administration," Our client, an AgTech platform transforming out grower management in Africa, is actively seeking a dedicated Implementation Officer to join their exceptional team . Your mission is to ensure a seamless setup, rollout, and sustained adoption of the client's platform ."
Marketing Executive at a Reputable Company,Marketing Executive at a Reputable Company,,,Provide accurate and compelling information to clients regarding available advertising opportunities and locations.,,,Marketing," Client Relationship Management is a key point of contact for client queries, ensuring timely and satisfactory resolution . It is also a key role in developing and executing marketing plans and campaigns for the company ."
Finance Manager at Teleperformance,Teleperformance,"Certified/Chartered Public Accountant (CPA), Association of Chartered Certified Accountants (ACCA) or equivalent qualification is required for this position.",Good written and verbal skills in the English language.,,"Proficiency in MS-Office with significant experience in excel, accounting package knowledge will be an added advantage",,Finance, Responsibilities include Account Receivable Management and Account Payable Management . Review contract or prepare purchase order of new client before empanelment of clients . Follow up with stakeholder for collection of money .
Quality Control Officer at Victory Farms,Victory Farms,,,,Minimum of 2-3 years experience in food quality control and safety.,,IT," Quality Control Officer will be responsible for monitoring and ensuring that our product comply with safety and quality standards . This role is crucial for conducting inspections and tests, maintaining accurate records, and collaborating with production teams to resolve quality issues ."
Vacancies at Nyandarua Water & Sanitation Company,Nyandarua Water & Sanitation Company,"Full professional qualification in either CPA (K), ACCA, CISA or CIA.",Excellent planning and organizational skills.,,At least 3 years’ experience in a senior management position.,,Other," The successful candidate will be responsible for providing the conduct of independent appraisal of the effectiveness and improvement of policies, procedures and standards of management of financial and physical resources ."
Junior Sous Chef at Accor,Accor,Qualifications,Strong culinary skills and knowledge of various cooking techniques.,,"Proven experience in a professional kitchen, preferably as a chef de partie or junior sous chef.",,Other," The Junior Sous Chef is responsible for ensuring high standards of food preparation, quality, and hygiene . This role supports daily kitchen activities, supervises junior kitchen staff and helps maintain an efficient and organized kitchen environment ."
Nurse in Charge at Jacaranda Maternity,Jacaranda Maternity,,Knowledge and Skills Requirements,"We are expanding to new locations and require additional Charge Nurse for upcoming location in Nairobi. Reporting to the Branch Manager, you will take on responsibility of overseeing the Nursing care of the branch by managing resources and staff, growing the locations revenue, delivering quality client experience and maintaining superior patient satisfaction.","We are expanding to new locations and require additional Charge Nurse for upcoming location in Nairobi. Reporting to the Branch Manager, you will take on responsibility of overseeing the Nursing care of the branch by managing resources and staff, growing the locations revenue, delivering quality client experience and maintaining superior patient satisfaction.",,Healthcare," We are expanding to new locations and require additional Charge Nurse for upcoming location in Nairobi . Reporting to the Branch Manager, you will take on responsibility of overseeing the Nursing care of the branch ."
Audit Assistant at MNC Consulting Group Limited,MNC Consulting Group Limited,QUALIFICATIONS,Strong numerical and analytical skills.,,,,Administration," At least CPA intermediate level with strong numerical and analytical skills . Includes basic knowledge of accounting standards and audit procedures . Includes proficiency in Microsoft Office, excellent attention to detail and organizational skills ."
Jobs at Belva Digital,Belva Digital,,,,,,Other, Shortlised candidates will be contacted by shortlised applicants . Only shortlified candidates will have to be contacted . Go to method of application to apply for the job .
Latest Jobs at Gertrude's Children's Hospital,Gertrude's Children's Hospital,,,,,,Other, Gertrude's Children’s hospital is looking for a Financial & Operations Internal Auditor . Responsibilities include designing audit procedures to execute the annual audit plan . Reviewing reliability and integrity of financial and operating information .
Vacancies at Mama Ngina University College (MNUC),Mama Ngina University College (MNUC),,Possession of instructions pedagogical skills will be an added advantage,,At least three (3) years of relevant experience in a learning institution or ICT support role;,,Other," Duties and responsibilities: Maintaining and troubleshoot computers, printers, and networking equipment in University College labs . Provide orientation on laboratory rules, usage policies, and best practices in digital safety; monitor lab usage to prevent unauthorized access and ensure data security ."
Associate Agronomy Advisor at TechnoServe Kenya,TechnoServe Kenya,,Required skills and experience,,Required skills and experience,,Other, The Associate Agronomy Advisor shall support the implementation of strategies that will enable clients to achieve sustainable increases in coffee quality and yields . The role is to help smallholder coffee farmers and local stakeholders on the TechnoServe coffee project work .
Payroll Accounts Officer at World Vision Kenya,World Vision Kenya,Degree in Human Resources/Administration and or Accounting/Finance Qualification,Strong analytical skills,"Prepare contract adjustment letters – Salary adjustments, change in location et al",Educational and Experience Required,,Administration, The role involves accurately processing payroll on time and making sure that statutory deductions and key payroll deduction paid on specific dates . The role also involves contract management and facilitating the signing of documents .
Careers at APA Life Assurance Company Ltd,APA Life Assurance Company Ltd,ACADEMIC QUALIFICATIONS,JOB SKILLS AND REQUIREMENTS,,"Proactively maintain claims data to identify trends, gaps, risks and opportunities and share them with the team; use the insights to build innovative ways to improve APA Life claims experience.",,Other," Processing and paying of all non-risk Individual Life claims as and when they are due . Maintaining constant engagement and follow up with clients on pending payments . Proactively maintain claims data to identify trends, gaps, risks and opportunities ."
Laboratory Technologist at Outspan Hospital,Outspan Hospital,Qualifications and Requirements,Other Desirable Skills,,At least two (2) years experience in a hospital laboratory,,Other, Roles and Responsibilities: To perform clinical laboratory tests and provide accurate and timely results . Support development and maintenance of the laboratory QMS based on ISO 15189:2022 criteria . Qualifications and Requirements: Diploma in Medical Laboratory Sciences or a Higher diploma in Histopathology .
Fashion Retail Manager (Karen) at Gap Recruitment Services Limited,Gap Recruitment Services Limited,,Strong team management and coordination skills.,,At least 3-5 years of experience in a related field.,,IT," Employers need a strong sense of responsibility, positive attitude, and good professional ethics . Responsibilities: Oversee and manage daily store operations, ensuring smooth and efficient functioning ."
Customer Experience Manager at Rose Avenue Group,Rose Avenue Group,,Excellent communication & Interpersonal skills,,Exceptional Customer Experience,,Other, Job Responsibilities include managing a team that reduces pain points for the public . The team will work together to improve the quality of service to the public.
Cloud Support & Implementation Specialist at Samaritans Purse,Samaritans Purse,,,,,,Other," In the role of Support & Implementation Specialist, you will have the opportunity to:Maintain a personal, active relationship with Jesus Christ and is a consistent witness for Jesus Christ . Diagnose and resolves technical issues reported by partners, providing timely and effective solutions to minimize service disruptions .Guide partners through the configuration of ACS products according to partner needs, tailoring settings to meet specific business requirements ."
Tupande Market Access Associate at One Acre Fund,One Acre Fund,Qualifications,,,4+ years of working experience with 3+ years of strategy or management consulting experience,,Other," As the Market Access Associate, you will lead innovation, growth and continuous improvement across markets to maximize impact for smallholder farmers and value for Tupande . This is a remote position based in Nairobi, Kenya with field travel required ."
Server at Fairmont Hotels & Resorts,Fairmont Hotels & Resorts,Qualifications,Excellent written/verbal communication and interpersonal skills,,"Crisp, Efficient Food and beverage service with excellent rapport building – provides an experience, not just a meal.",,IT," Job Description: Reporting to the F&B Manager, responsibilities and essential job functions include but are not limited to the following: Sets up and tears down service stations. Taking table orders for all food and beverage from the guests and serve in a professional and positive manner."
Restaurant Supervisor at Nexus Staffing Solutions,Nexus Staffing Solutions,,"Strong leadership, communication, and interpersonal skills.",,"Our client, a well-established and fast-paced restaurant in Nairobi, is seeking to hire a Restaurant Supervisor who is proactive, energetic, and experienced in managing a busy restaurant environment. The ideal candidate is someone who can lead a team, ensure smooth daily operations, and deliver excellent customer service under pressure.",,Other," The ideal candidate is someone who can lead a team, ensure smooth daily operations, and deliver excellent customer service under pressure . Key Responsibilities: Supervise daily front-of-house and back of-house operations to ensure seamless restaurant functioning ."
Career Opportunities at Tugende,Tugende,Qualifications and Experience,"This role demands a proactive and highly organized individual with excellent interpersonal skills, a solid grasp of HR best practices, and the ability to balance strategic initiatives with hands-on operational HR work.",,Qualifications and Experience,,Other," The Senior HR Officer will coordinate recruitment, performance, employee relations, training, and compliance . The successful candidate will exemplify and embrace Tugende’s Core Values of: Integrity, Empathy, Solutions Oriented, Work as a Team and Always Growing ."
Showroom Manager at KEDA Kenya Ceramics Company Limited,KEDA Kenya Ceramics Company Limited,Candidates with retail sales certification or large-scale store promotion awards will be preferred.,"Train staff to improve sales techniques, customer service, and inventory management skills.Monitor employee performance and enforce operational standards.",,"Guide sales and customer service teams to enhance performance and customer experience.Maintain and regularly update customer databases, including visitor records.Handle wholesale and project orders, coordinating delivery logistics.",,Other," Sales & Marketing Management: Oversee all sales and marketing activities in the showroom . Maintain daily, weekly, and monthly reporting and planning systems ."
Data Science Senior Technical Mentor at Moringa School,Moringa School,,,,"The ideal candidate has demonstrated experience in data science and working well in diverse teams, even in a dynamic and changing environment. The Technical Mentor role provides the mentorship and supervision necessary to ensure that their students have a 5-star experience and achieve strong outcomes.",,IT, The Technical Mentor role provides the mentorship and supervision necessary to ensure students have a 5-star experience and achieve strong outcomes . The ideal candidate has demonstrated experience in data science and working well in diverse teams .
Safety Associate Specialist with English Language at IQVIA,IQVIA,,Excellent written and verbal skills in English (min. C1),,Minimum Required Education and Experience,,Other," The Safety Associate, IQVIA Safety Operations team, will review, assess and process safety data and information, received from various sources and distributed reports onwards to both internal and external third parties ."
Finance Officer - Grants at World Agroforestry Centre (ICRAF),World Agroforestry Centre (ICRAF),,"Strong computer skills in word processing, databases, and other relevant office applications.",Collaborate with Principal Investigator (PI) regarding staff time allocation to be updated in the system.,"Education, knowledge and experience",,Finance, Duties and responsibilities:Monitor Budget and Actual Expenses of restricted grants . Review and verify expenditures of restricted projects assigned to ensure adherence to budgetary and donor requirements .
Director of Programmes at Access Agriculture,Access Agriculture,Qualifications and key skills,Qualifications and key skills,Location,Experience in management of international development programmes,,Other, Duties: To work closely with the Executive Director and colleagues to ensure timely compliance with multiple project activities . Establish reporting and activity schedules for different projects. Work with the Finance team to ensure compliance with project demands.
Vacancies at ibuQa.io,ibuQa.io,,,,,,Other, Only shortlisted candidates will be contacted by the shortlisted candidate . Only shortlist candidates will have to be shortlisted before being contacted . Go to method of application » » » .
Job Recruitment at Agricultural Employers’ Association,Agricultural Employers’ Association,Qualifications and Requirements,"Proven basic computer skills (e.g., MS Office, report writing).",,We are seeking to recruit a TRAINING OFFICER specializing in STATUTORY TRAININGS in OCCUPATIONAL SAFETY AND HEALTH (OSH). The ideal candidate should have a strong background in Science or OSH with a solid record of hands-on experience and training delivery in the field.,,Other, We are seeking a TRAINING OFFICER specializing in OCCUPATIONAL SAFETY and HEALTH (OSH) The ideal candidate should have a strong background in Science or OSH .
Intern - Communications at Danish Refugee Council,Danish Refugee Council,,Build the Intern’s Professional Skills,,"The Project Communications Intern will support the communication aspects of peacebuilding projects aimed at promoting peace, social cohesion, and conflict resolution in the Karamoja region. Alongside gains in terms of experience, the intern will assist in documenting project activities, creating content for various communication platforms, and supporting stakeholder engagement. The intern will also work in collaboration with the project teams and partners in amplify the impact of the project by ensuring consistent messaging, visibility of achievements, and effective dissemination of information that maintains visibility of the project.",,Other," The Project Communications Intern will support the communication aspects of peacebuilding projects aimed at promoting peace, social cohesion, and conflict resolution in the Karamoja region . The intern will assist in documenting project activities, creating content for various communication platforms, and supporting stakeholder engagement ."
Graduate Trainee Program at Gulf African Bank,Gulf African Bank,,,,,,IT," The Graduate Trainees will get the opportunity to gain practical insight of the financial sector through an intensive 18 Month on-the-job training in various functions in the bank, mentorship programs as well as structured online and in person training ."
"Associate Director of Finance, Africa Region at Nature Conservancy",Nature Conservancy,,,,"Bachelor’s degree in Finance, Accounting, Business Administration or related field and 7 years related work experience, or equivalent combination of education and experience.",,Finance, The Finance/Accounting Manager II manages the activities and personnel for all aspects of a significant finance or accounting area at the corporate or major unit level . They provide high-level financial analysis to senior organizational leadership .
Jobs at BRAC,BRAC,,,,"The Digital Financial Services (DFS) Manager will drive the implementation of BKCL digital strategies that aim to increase outreach, deliver a superior customer experience, increase organizational efficiency, and find the right balance between tech and touch for BKCL customers.",,Other," The Digital Financial Services (DFS) Manager will drive the implementation of BKCL digital strategies that aim to increase outreach, deliver a superior customer experience . The DFS Manager will think creatively to innovate new uses for technology to address access, usage, literacy, security, and other barriers limiting the use of DFS by BRAC’s existing and target customers especially women and youth ."
Customer Experience Officer at M-KOPA Solar,M-KOPA Solar,,"Technical proficiency in diagnosing and troubleshooting M-KOPA products is essential, with motorbike knowledge being advantageous. You should have strong Microsoft Office skills (Excel, PowerPoint) for reporting and presentations, along with data interpretation abilities to derive insights from customer data.",,We are looking for a Customer Experience Officer to join our Mobility Customer Experience group; as we scale up and drive digital and financial inclusion across our markets.,,Administration, We are looking for a Customer Experience Officer to join our Mobility Customer Experience group . You will ensure seamless onboarding and adoption of M-KOPA's mobility products .
Assistant Relationship Manager at Britam,Britam,"Knowledge, experience and qualifications required",,,"Applies knowledge, resources, and experience to resolve problems.",,Administration," Collaboratively, work closely with other team members to implement strategies for the allocated Bank partners for profitable business acquisition for all lines of businesses (GI, EMC, Life & Pension)"
Ongoing Recruitment at Pwani University,Pwani University,Academic Qualifications,,,,,Other, This is a University teaching/research position . Applicants must have an earned PhD or a Master's Degree or equivalent qualification in the specified area from an accredited and recognized University .
